<?xml version="1.0"?>
<!DOCTYPE entity PUBLIC "-//FERMENTER//DTD ENTITY//EN" "https://bitbucket.org/cpointe/fermenter/downloads/fermenter-2-entity.dtd">

<entity>
	<name>IdentityKeyedEntity</name>
	<documentation>Entity that demonstrates uses of an IDENTITY as a generated value primary key</documentation>
	<table>IDENTITY_KEYED_ENTITY</table>

	<id>
		<field>
			<name>id</name>
			<type>integer</type>
			<column>IDENTITY_KEYED_ENTITY_ID</column>
			<required>true</required>
			<generator>identity</generator>
		</field>
	</id>

</entity>