<?xml version="1.0"?>
<!DOCTYPE entity PUBLIC "-//FERMENTER//DTD ENTITY//EN" "https://bitbucket.org/cpointe/fermenter/downloads/fermenter-2-entity.dtd">

<entity>
	<name>Placeholder</name>
	<namespace>org.bitbucket.askllc.fermenter.cookbook.local.referencing.domain</namespace>
	<documentation>
		Generate an entity so we can not only test local call
		optimization
	</documentation>
	<table>PLACEHOLDER</table>

	<id>
		<field>
			<name>id</name>
			<type>uuid</type>
			<column>PLACEHOLDER_ID</column>
			<required>true</required>
			<generator>uuid</generator>
		</field>
	</id>

</entity>