<?xml version="1.0" encoding="UTF-8"?>
<!DOCTYPE entity PUBLIC "-//FERMENTER//DTD ENTITY//EN" "https://bitbucket.org/cpointe/fermenter/downloads/fermenter-2-entity.dtd">

<entity>
	<name>ForeignKeyWithoutColumnDefinition</name>
	<table>FK_WITHOUT_COLUMN_DEFINITION</table>
	<id>
		<field>
			<name>id</name>
			<type>uuid</type>
			<column>FK_WITHOUT_COLUMN_DEFINITION_ID</column>
			<required>true</required>
			<generator>uuid</generator>
			<label>FK column is not defined in the relation</label>
		</field>
	</id>

</entity>