<?xml version="1.0" encoding="UTF-8"?>
<!DOCTYPE entity PUBLIC "-//FERMENTER//DTD ENTITY//EN" "https://bitbucket.org/cpointe/fermenter/downloads/fermenter-2-entity.dtd">

<entity>
	<name>ForeignKeyColumnCustomName</name>
	<table>FK_CUSTOM_NAME</table>
	<id>
		<field>
			<name>id</name>
			<type>uuid</type>
			<column>FK_CUSTOM_NAME</column>
			<required>true</required>
			<generator>uuid</generator>
			<label>Column unrelated to table name and doesn't have id</label>
		</field>
	</id>

</entity>