<?xml version="1.0"?>
<!DOCTYPE entity PUBLIC "-//FERMENTER//DTD ENTITY//EN" "https://bitbucket.org/askllc/fermenter/downloads/fermenter-2-entity.dtd">

<entity>
	<name>SimpleDomainChild</name>
	<documentation>Child end of the 1-M relationship with SimpleDomain</documentation>
	<table>SIMPLE_DOMAIN_CHILD</table>

	<id>
		<field>
			<name>id</name>
			<type>string</type>
			<column>SIMPLE_DOMAIN_CHILD_ID</column>
			<required>true</required>
			<generator>uuid</generator>
		</field>
	</id>

	<fields>
		<field>
			<name>name</name>
			<documentation>Name of the child entity</documentation>
			<type>string</type>
			<column>NAME</column>
		</field>
	</fields>

</entity>