<?xml version="1.0"?>
<!DOCTYPE entity PUBLIC "-//FERMENTER//DTD ENTITY//EN" "https://bitbucket.org/cpointe/fermenter/downloads/fermenter-2-entity.dtd">

<entity>
	<name>LongKeyedEntity</name>
	<documentation>Entity that demonstrates uses a long as a generated value primary key</documentation>
	<table>LONG_KEYED_ENTITY</table>

	<id>
		<field>
			<name>id</name>
			<type>long</type>
			<column>LONG_KEYED_ENTITY_ID</column>
			<required>true</required>
			<generator>auto</generator>
		</field>
	</id>

</entity>