<?xml version="1.0"?>
<!DOCTYPE entity PUBLIC "-//FERMENTER//DTD ENTITY//EN" "https://bitbucket.org/cpointe/fermenter/downloads/fermenter-2-entity.dtd">

<entity>
	<name>MappedSuperclassOneToManyChild</name>
	<documentation>Child entity of MappedSuperclassParent demonstrating an inheritance hierarchy with a mapped superclass strategy</documentation>
	<parent>
		<type>MappedSuperclassParent</type>
		<inheritanceStrategy>mapped-superclass</inheritanceStrategy>
	</parent>
	<table>MAPPED_SUPERCLASS_CHILD</table>
	
	<id>
		<field>
			<name>id</name>
			<type>uuid</type>
			<column>MAPPED_SUPERCLASS_CHILD_ID</column>
			<required>true</required>
			<generator>uuid</generator>
		</field>
	</id>

	<fields>
		<field>
			<name>someValue</name>
			<documentation>String value specific to this subclass</documentation>
			<type>string</type>
			<column>SOME_VALUE</column>
		</field>
	</fields>

</entity>